{
  "version": "1.0",
  "agent_id": "agent://idevsec/steward",
  "owner": "Creduent",
  "public_key": "ed25519:uMMQ6RfZB5RJuYcZPwzLoiv8b6EQfU7CUJ2oLragCHg=",
  "endpoint": "https://api.idevsec.com",
  "capabilities": [
    "osint",
    "dns_lookup",
    "vulnerability_scan"
  ],
  "issued_at": "2026-05-29T00:04:16Z",
  "signature": "cJpCCaWZGwNZjougKN4RNPL5QR/cW2ST7LIbMqURXg74qTmhgcksyOgGYnxLp48oxDOUy/78OKTIa+e33iSsBw=="
}