{
  "version": "1.0",
  "agent_id": "agent://example/agent",
  "owner": "Example Corp",
  "public_key": "ed25519:MI0YrgwrpBd21mfwWi5Kyme8J32JBpRStfLeTjrYZVU=",
  "endpoint": "https://example.com/agent",
  "capabilities": [
    "scan",
    "query"
  ],
  "issued_at": "2026-05-29T00:04:16Z",
  "signature": "7TzK1gKFw9pSvCaW6fi1ewwk7xJPh85ggLdV5x1oGZ8TlFNRxZbaBQdgI9BjhQzRN6qNyHutt2YIcPhfhNw8DA=="
}